{
  "schemaVersion": "m2-final-release-closure/v1",
  "releaseId": "M2-RC1",
  "version": "0.12.0",
  "phase": "FINAL_RELEASE_CLOSURE",
  "closureBaseSha": "70b06e28e48c38d8b7feed29177144d35cb96069",
  "source": {
    "mergePullRequest": 38,
    "expectedHeadSha": "7880dc9e95e80327960030e9e003189202c4a85f",
    "mergeSha": "70b06e28e48c38d8b7feed29177144d35cb96069"
  },
  "portableReadiness": {
    "path": "releases/m2/portable-release-readiness.json",
    "canonicalDigest": "sha256:32a5487c9e83edebc7f3d84b192cdfedf17f58edab904991555d922b5e2d5995",
    "repositoryReleaseReady": true,
    "environmentPromotionEvaluated": false,
    "environmentPromotionEligible": null
  },
  "postMergeVerification": {
    "generalValidation": {
      "runId": 30523601698,
      "validateJobId": 90809365725,
      "postgresJobId": 90809365768,
      "artifacts": {
        "repositoryValidation": {
          "id": 8751775377,
          "digest": "sha256:81c7bbf9ac9f6e2f6e45e5e3924216ce1c6f8fdb260334495d077835a8fd446c"
        },
        "deploymentValidation": {
          "id": 8751776207,
          "digest": "sha256:b11e61936c6c7656b8b717ac9717e3abb29c27b705745f2593a30accaf8367d4"
        },
        "historicalR2A": {
          "id": 8751777537,
          "digest": "sha256:b81897cd37c395e9ec585ceb3a9c75f6723550f0a8afdd8c02be6197d8865295"
        },
        "postgres": {
          "id": 8751782766,
          "digest": "sha256:87882aac4aa9408ad2484da3c5c672442995d915dc49708c3eacfc981d27e35f"
        }
      }
    },
    "portableReadiness": {
      "runId": 30523600767,
      "validateJobId": 90809362714,
      "postgresJobId": 90809362694,
      "artifacts": {
        "readiness": {
          "id": 8751779388,
          "digest": "sha256:c86a3d95559b5384f7e99bd9bf1a66ce8fd0ccb2b483b47631c3a767c20dd074"
        },
        "postgres": {
          "id": 8751780624,
          "digest": "sha256:27d529a61fe992ce91416afb49e791d5720a614de5ba6e82d865fe752b324e7b"
        }
      }
    },
    "historicalR2A": {
      "runId": 30523600763,
      "validateJobId": 90809363100,
      "postgresJobId": 90809363031,
      "artifacts": {
        "evidence": {
          "id": 8751777809,
          "digest": "sha256:825016ed46b261075fc078e585e97a47b8552fed6f86e4b60dc4eee3d4cab78c"
        },
        "postgres": {
          "id": 8751781769,
          "digest": "sha256:45520eedc1b3a24889a5629b674faf13570e175c235102643c0e7cf5c94b5874"
        }
      }
    },
    "observer": {
      "controlPullRequest": 39,
      "closedWithoutMerge": true,
      "runId": 30524112914,
      "jobId": 90810968107,
      "artifact": {
        "id": 8751973494,
        "digest": "sha256:38263d550408d8ca96e9c951ec2f22ccfde2bc587229ae991dfc8f1eca8fad24",
        "expiresAt": "2026-10-28T07:47:26.000Z"
      }
    }
  },
  "historicalEvidence": {
    "productionPromotionDigest": "sha256:4125d5f08ec559e2bc6012ab501879432493af012b4d70665eb1d653c4190f5d",
    "externalEvidenceIntakeDigest": "sha256:54413977a3030847fdef7e3aa77c2a1c2924677f0555a4fabdba888f829a6d18",
    "imageBindingDigest": "sha256:adb6374bee157b7b64d25b6fdfe1b35ea2d4e5e92a08b029c0fbc5e66c33c0a7",
    "deploymentDigest": "sha256:fb2cb10f42f8d3473c1997c514ec11eb66bfb06f7542c3404c328c39f8763a45"
  },
  "decision": {
    "m2Rc1Closed": true,
    "repositoryReleaseReady": true,
    "environmentPromotionEvaluated": false,
    "environmentPromotionEligible": null,
    "m3PlanningReady": true,
    "m3ImplementationStarted": false,
    "nextRequiredSlice": "M3-R0",
    "repositoryBlockers": []
  },
  "safetyBoundary": {
    "secretAccessed": false,
    "secretCreated": false,
    "targetClusterAccessed": false,
    "targetClusterModified": false,
    "approvalCreated": false,
    "rolloutExecuted": false,
    "imagePublished": false,
    "registryDigestChanged": false,
    "executionAdapterImplemented": false,
    "externalProcessExecuted": false,
    "workerAdded": false,
    "queueAdded": false,
    "schedulerAdded": false
  }
}
